Titel,Personen,Jahr,Peer-Review erfolgt,Übergeordneter Typ,Serienvolumen,Seriennummer,Serienname,APA-Format
"The Impact of Labour Market Institutions and Capital Accumulation on Unemployment: Evidence for the OECD, 1985-2013","Heimberger, Philipp",2019,Nicht festgelegt,"Preprints, Working Paper und Forschungsberichte",,164,wiiw Working Papers,"Heimberger, P. (2019). The Impact of Labour Market Institutions and Capital Accumulation on Unemployment: Evidence for the OECD, 1985-2013. (wiiw Working Papers; Nr. 164)."
Creating a pluralist paradigm: An application to the minimum wage debate,"Schütz, Bernhard",2021,begutachtet,Beitrag in Fachzeitschrift,,,,"Schütz, B. (2021). Creating a pluralist paradigm: An application to the minimum wage debate. Journal of Economic Issues, 55(1), 103-124. https://doi.org/10.1080/00213624.2021.1874786"
Creating a pluralist paradigm: An application to the minimum wage debate,"Schütz, Bernhard",2019,begutachtet,Beitrag in Buch/Bericht/Konferenzband,,,,"Schütz, B. (2019). Creating a pluralist paradigm: An application to the minimum wage debate. In Momentum Kongress Paper (S. 1-41)"
Plurale Ökonomik - Eine kurze Einführung,"Porak, Laura",2020,begutachtet,Beitrag in Buch/Bericht/Konferenzband,,,,"Piétron, D., Porak, L., & Thieme, S. (2020). Plurale Ökonomik - Eine kurze Einführung. In Thielscher, Christian (Hrsg.), Wirtschaftswissenschaften verstehen (S. 189-205). Springer Gabler. "
Does employment protection affect unemployment? A meta-analysis,"Heimberger, Philipp",2021,begutachtet,Beitrag in Fachzeitschrift,,,,"Heimberger, P. (2021). Does employment protection affect unemployment? A meta-analysis. Oxford Economic Papers, 73(3), 982-1007. https://doi.org/10.1093/oep/gpaa037"
Wohin steuert die Europäische Union? Ein Klärungsversuch der strategischen Ausrichtung der EU seit Lissabon,"Porak, Laura",2020,begutachtet,Beitrag in Buch/Bericht/Konferenzband,,,,"Porak, L. (2020). Wohin steuert die Europäische Union? Ein Klärungsversuch der strategischen Ausrichtung der EU seit Lissabon. In Momentum Kongress Paper (S. 1-22)"
Polanyi and Schumpeter: Transitional Processes via Societal Spheres,"Hager, Theresa (+1 weitere)",2022,Nicht festgelegt,"Preprints, Working Paper und Forschungsberichte",,16,SPACE Working Paper Series,"Hager, T., Heck, I., & Rath, J. (2022). Polanyi and Schumpeter: Transitional Processes via Societal Spheres. (S. 1-25). (SPACE Working Paper Series; Nr. 16)."
Agent of Sustainable Change - Der unternehmerische Staat und sozial-ökologische Transformation,"Strohmaier, Rita",2021,begutachtet,Beitrag in Buch/Bericht/Konferenzband,,,Jahrbuch Normative und institutionelle Grundfragen der Ökonomik,"Strohmaier, R. (2021). Agent of Sustainable Change - Der unternehmerische Staat und sozial-ökologische Transformation. In Klüh, Ulrich; Sturn, Richard (Hrsg.), Der Staat in der großen Transformation. Jahrbuch Normative und institutionelle Grundfragen der Ökonomik (S. 169-192). (Jahrbuch Normative und institutionelle Grundfragen der Ökonomik). Metropolis. "
Does economic globalization affect government spending? A meta-analysis,"Heimberger, Philipp",2021,begutachtet,Beitrag in Fachzeitschrift,,,,"Heimberger, P. (2021). Does economic globalization affect government spending? A meta-analysis. Public Choice, 187(3-4), 349-374. https://doi.org/10.1007/s11127-020-00784-8"
Unternehmenskonzentrationen in der Fleischbranche und die performative Rolle der Agrarökonomik,"Hirte, Katrin",2021,begutachtet,Beitrag in Fachzeitschrift,,,,"Hirte, K. (2021). Unternehmenskonzentrationen in der Fleischbranche und die performative Rolle der Agrarökonomik. ÖZS - Österreichische Zeitschrift für Soziologie, 46(2), 187-206. https://doi.org/10.1007/s11614-021-00448-x"
Pluralism in economics: its critiques and their lessons,"Strunk, Birte (+1 weitere)",2020,begutachtet,Beitrag in Fachzeitschrift,,,,"Gräbner, C., & Strunk, B. (2020). Pluralism in economics: its critiques and their lessons. Journal of Economic Methodology, 27(4), 311-329. https://doi.org/10.1080/1350178X.2020.1824076"
Does economic globalisation affect income inequality? A meta-analysis,"Heimberger, Philipp",2020,begutachtet,Beitrag in Fachzeitschrift,,,,"Heimberger, P. (2020). Does economic globalisation affect income inequality? A meta-analysis. The World Economy, (11), 1-23. https://doi.org/10.1111/twec.13007"
Die Auswirkung von Mindestlöhnen auf die Arbeitslosigkeit: Ein Paradigmenvergleich,"Schütz, Bernhard",2020,begutachtet,Beitrag in Buch/Bericht/Konferenzband,,,,"Schütz, B. (2020). Die Auswirkung von Mindestlöhnen auf die Arbeitslosigkeit: Ein Paradigmenvergleich. In Stephan Pühringer, Silja Graupe, Katrin Hirte, Jakob Kapeller, Stephan Panther (Hrsg.), Jenseits der Konventionen: Alternatives Denken zu Wirtschaft, Gesellschaft und Politik (S. 157-173). Metropolis. "
Pandemic pushes polarisation: the Corona crisis and macroeconomic divergence in the Eurozone,"Kapeller, Jakob (+2 weitere)",2020,begutachtet,Beitrag in Fachzeitschrift,,,,"Gräbner, C., Heimberger, P., & Kapeller, J. (2020). Pandemic pushes polarisation: the Corona crisis and macroeconomic divergence in the Eurozone. Journal of Industrial and Business Economics, 47(3), 425-438. https://doi.org/10.1007/s40812-020-00163-w"
Structural change in times of increasing openness: assessing path dependency in European economic integration,"Kapeller, Jakob (+3 weitere)",2020,begutachtet,Beitrag in Fachzeitschrift,,,,"Gräbner, C., Heimberger, P., Kapeller, J., & Schütz, B. (2020). Structural change in times of increasing openness: assessing path dependency in European economic integration. Journal of Evolutionary Economics, 30(5), 1467-1495. https://doi.org/10.1007/s00191-019-00639-6"
"Is the Eurozone disintegrating? Macroeconomic divergence, structural polarization, trade and fragility","Kapeller, Jakob (+3 weitere)",2020,begutachtet,Beitrag in Fachzeitschrift,,,,"Gräbner, C., Heimberger, P., Kapeller, J., & Schütz, B. (2020). Is the Eurozone disintegrating? Macroeconomic divergence, structural polarization, trade and fragility. Cambridge Journal of Economics, 44(3), 647-669. https://doi.org/10.1093/cje/bez059"
"""Ohne Effizienz geht es nicht"". Ergebnisse einer qualitativ-empirischen Erhebung unter Studierenden der Volkswirtschaftslehre","Bäuerle, Lukas (+2 weitere)",2019,Nicht festgelegt,"Preprints, Working Paper und Forschungsberichte",,13,FGW-Studien,"Bäuerle, L., Pühringer, S., & Ötsch, W. (2019). ""Ohne Effizienz geht es nicht"". Ergebnisse einer qualitativ-empirischen Erhebung unter Studierenden der Volkswirtschaftslehre. (FGW-Studien; Nr. 13). FGW. https://www.ssoar.info/ssoar/handle/document/67301"
Ideas have Consequences: Eine vergleichende Analyse zur transformativen Rolle von Ideen.,"Grimm, Christian",2019,begutachtet,Beitrag in Fachzeitschrift,,,,"Grimm, C. (2019). Ideas have Consequences: Eine vergleichende Analyse zur transformativen Rolle von Ideen. Momentum Quarterly, 8(4), 183-247. https://doi.org/10.15203/momentumquarterly.vol8.no4.p215-229"
Think Tank Networks of German Neoliberalism. Power Structures in Economics and Economic Policies in Post-War Germany,"Pühringer, Stephan",2020,begutachtet,Beitrag in Buch/Bericht/Konferenzband,,,,"Pühringer, S. (2020). Think Tank Networks of German Neoliberalism. Power Structures in Economics and Economic Policies in Post-War Germany. In Mirowski, Philip; Plehwe, Dieter; Slobodian, Quinn (Hrsg.), Nines Lives of Neoliberalism (S. 283-306). Verso Books. "
"Arbeitsmarktinstitutionen, Kapitalakkumulation und Arbeitslosigkeit in OECD-Ländern, Wirtschaft und Gesellschaft","Heimberger, Philipp",2019,begutachtet,Beitrag in Fachzeitschrift,,,,"Heimberger, P. (2019). Arbeitsmarktinstitutionen, Kapitalakkumulation und Arbeitslosigkeit in OECD-Ländern, Wirtschaft und Gesellschaft. Wirtschaft und Gesellschaft, 45(1)."
The power of economic models: The case of the EU's fiscal regulation framework,"Kapeller, Jakob (+1 weitere)",2020,begutachtet,Beitrag in Fachzeitschrift,,,,"Heimberger, P., Huber, J., & Kapeller, J. (2020). The power of economic models: The case of the EU's fiscal regulation framework. Socio-Economic Review, 18(2), 337-366. https://doi.org/10.1093/ser/mwz052"
How much space for fiscal expansion? Germany falls victim to 'output gap nonsense’,"Heimberger, Philipp",2019,nicht begutachtet,Andere Beiträge,,,,"Heimberger, P. (2019, Dez). How much space for fiscal expansion? Germany falls victim to 'output gap nonsense’."
Deutungsrahmen der aktiven Arbeitsmarktpolitik: ein deutsch-österreichischer Vergleich von diskursiven Frames aus Anlass von 50 Jahren Arbeits(markt)förderungsgesetz,"Griesser, Markus",2019,begutachtet,Beitrag in Fachzeitschrift,,,,"Griesser, M. (2019). Deutungsrahmen der aktiven Arbeitsmarktpolitik: ein deutsch-österreichischer Vergleich von diskursiven Frames aus Anlass von 50 Jahren Arbeits(markt)förderungsgesetz. Momentum Quarterly, 8(3), 166-182. https://doi.org/10.15203/momentumquarterly.vol8.no3.p166-182"
Confict as a closure: A Kaleckian model of growth and distribution under fnancialization,,2019,Nicht festgelegt,"Preprints, Working Paper und Forschungsberichte",,96,ICAE Working Paper Series,"Raghavendra, S., & Piiroinen, P. T. (2019). Confict as a closure: A Kaleckian model of growth and distribution under fnancialization. (ICAE Working Paper Series; Nr. 96)."
Vorschlag für eine Jobgarantie für Langzeitarbeitslose in Österreich,,2019,Nicht festgelegt,"Preprints, Working Paper und Forschungsberichte",,100,ICAE Working Paper Series,"Tamesberger, D., & Theurl, S. (2019). Vorschlag für eine Jobgarantie für Langzeitarbeitslose in Österreich. (ICAE Working Paper Series; Nr. 100)."
Hans Albert und die Kritik am Modell-Platonismus in den Wirtschaftswissenschaften,"Ferschli, Benjamin (+1 weitere)",2019,begutachtet,Beitrag in Buch/Bericht/Konferenzband,,,,"Kapeller, J., & Ferschli, B. (2019). Hans Albert und die Kritik am Modell-Platonismus in den Wirtschaftswissenschaften. In Franco, Giuseppe (Hrsg.), Handbuch Karl Popper (S. 733-749). Springer Fachbuch. "
Pluralism in Economics: Epistemological Rationales and Pedagogical Implementation,"Kapeller, Jakob",2019,begutachtet,Beitrag in Buch/Bericht/Konferenzband,,,,"Kapeller, J. (2019). Pluralism in Economics: Epistemological Rationales and Pedagogical Implementation. In Decker, Samuel; Elsner, Wolfram; Flechtner, Svenja (Hrsg.), Advancing Pluralism in Teaching Economics (S. 55-77). Routledge. "
"Auftragsvergabe, Leistungsqualität und Kostenintensität im Schienenpersonenverkehr","Aistleitner, Matthias (+2 weitere)",2018,Nicht festgelegt,"Preprints, Working Paper und Forschungsberichte",,86,ICAE Working Paper Series,"Aistleitner, M., Grimm, C., & Kapeller, J. (2018). Auftragsvergabe, Leistungsqualität und Kostenintensität im Schienenpersonenverkehr. (ICAE Working Paper Series; Nr. 86)."
"Die Wirkmacht der ""Liebe zum Markt"": Zum anhaltenden Einfluss ordoliberaler ÖkonomInnenNetzwerke in Politik und Gesellschaft.","Pühringer, Stephan (+1 weitere)",2019,Nicht festgelegt,"Preprints, Working Paper und Forschungsberichte",,51,Working Paper Serie ök,"Pühringer, S., & Ötsch, W. (2019). Die Wirkmacht der ""Liebe zum Markt"": Zum anhaltenden Einfluss ordoliberaler ÖkonomInnenNetzwerke in Politik und Gesellschaft. (Working Paper Serie ök; Nr. 51)."
The anti-democratic logic of right-wing Populism and neoliberal market-fundamentalism,"Pühringer, Stephan (+1 weitere)",2019,Nicht festgelegt,"Preprints, Working Paper und Forschungsberichte",,48,Working Paper Serie ök,"Ötsch, W., & Pühringer, S. (2019). The anti-democratic logic of right-wing Populism and neoliberal market-fundamentalism. (Working Paper Serie ök; Nr. 48)."
Das Gemeine an der Gemeinwohldebatte,"Hirte, Katrin",2019,nicht begutachtet,Beitrag in Fachzeitschrift,,,,"Hirte, K., & Poppinga, O. (2019). Das Gemeine an der Gemeinwohldebatte. Wege für eine bäuerliche Zukunft – Zeitschrift der ÖBV/ Via Campesina Austria, 42(3 (358)), 7-9."
Antonino Palumbo and Alan Scott (2018): Remaking Market Society: A Critique of Social Theory and Political Economy in Neoliberal Times,"Beyer, Karl",2019,Nicht festgelegt,Beitrag in Fachzeitschrift,,,,"Beyer, K. (2019). Antonino Palumbo and Alan Scott (2018): Remaking Market Society: A Critique of Social Theory and Political Economy in Neoliberal Times. ÖZS - Österreichische Zeitschrift für Soziologie, 44(2), 249-252."
Folgen einer möglichen Abschaffung der Notstandshilfe in Oberösterreich,,2018,Nicht festgelegt,"Preprints, Working Paper und Forschungsberichte",,87,ICAE Working Paper Series,"Foissner, F. (2018). Folgen einer möglichen Abschaffung der Notstandshilfe in Oberösterreich. (ICAE Working Paper Series; Nr. 87)."
Divided we stand? Professional consensus and political conflict in academic economics,"Pühringer, Stephan (+1 weitere)",2019,Nicht festgelegt,"Preprints, Working Paper und Forschungsberichte",,51,Working Paper Serie ök,"Beyer, K., & Pühringer, S. (2019). Divided we stand? Professional consensus and political conflict in academic economics. (Working Paper Serie ök; Nr. 51)."
Exploring the trade narrative in top economics journals,"Aistleitner, Matthias (+1 weitere)",2019,Nicht festgelegt,"Preprints, Working Paper und Forschungsberichte",,97,ICAE Working Paper Series,"Aistleitner, M., & Pühringer, S. (2019). Exploring the trade narrative in top economics journals. (ICAE Working Paper Series; Nr. 97)."
A Comment on Fitting Pareto Tails to Complex Survey Data,"Kapeller, Jakob",2019,Nicht festgelegt,"Preprints, Working Paper und Forschungsberichte",,102,ICAE Working Paper Series,"Wildauer, R., & Kapeller, J. (2019). A Comment on Fitting Pareto Tails to Complex Survey Data. (ICAE Working Paper Series; Nr. 102)."
Holding Together what Belongs Together: A Strategy to Counteract Economic Polarisation in Europe,"Kapeller, Jakob (+2 weitere)",2019,nicht begutachtet,Andere Beiträge,,,,"Kapeller, J., Gräbner, C., & Heimberger, P. (2019, Sep). Holding Together what Belongs Together: A Strategy to Counteract Economic Polarisation in Europe."
Das dritte gossensche Gesetz,"Hirte, Katrin",2019,begutachtet,Beitrag in Buch/Bericht/Konferenzband,,,,"Hirte, K. (2019). Das dritte gossensche Gesetz. In Hochmann, Lars; Graupe, Silja; Korbun, Thomas; Panther, Stephan; Schneidewind, Uwe (Hrsg.), Möglichkeits¬wissen¬schaften. Ökonomie mit Möglichkeitssinn (S. 133-176). Metropolis Verlag. "
Was ist eine Krise? Wie ökonomische Theorien Wahrnehmung formen,"Pühringer, Stephan (+1 weitere)",2018,nicht begutachtet,Beitrag in Fachzeitschrift,,,,"Ötsch, W., & Pühringer, S. (2018). Was ist eine Krise? Wie ökonomische Theorien Wahrnehmung formen. Kurswechsel, (4/2018), 7-17."
Mythos Markt. Mythos Neoklassik. Das Elend des Marktfundamentalismus,"Ötsch, Walter",2018,nicht begutachtet,Buch,,,Kritische Studien zu Markt und Gesellschaft,"Ötsch, W. (2018). Mythos Markt. Mythos Neoklassik. Das Elend des Marktfundamentalismus. (Kritische Studien zu Markt und Gesellschaft). Metropolis."
"Export performance, price comeptitiveness and technology: Revisiting the Kaldor paradox","Kapeller, Jakob (+2 weitere)",2019,Nicht festgelegt,"Preprints, Working Paper und Forschungsberichte",,88,ICAE Working Paper Series,"Gräbner, C., Heimberger, P., & Kapeller, J. (2019). Export performance, price comeptitiveness and technology: Revisiting the Kaldor paradox. (ICAE Working Paper Series; Nr. 88)."
The dynamics of and on networks: an introduction,"Gräbner-Radkowitsch, Claudius",2018,begutachtet,Beitrag in Fachzeitschrift,,,,"Gräbner, C., Heinrich, T., Kudic, M., & Vermeulen, B. (2018). The dynamics of and on networks: an introduction. International Journal of Computational Economics and Econometrics, 8(3/4), 229-241."
Economic Polarisation in Europe: Causes and Policy Options,"Kapeller, Jakob (+2 weitere)",2019,nicht begutachtet,Andere Beiträge,,,,"Gräbner, C., Kapeller, J., & Heimberger, P. (2019, Jul). Economic Polarisation in Europe: Causes and Policy Options."
Unrealistic models and how to identify them: on accounts of model realisticness,"Gräbner-Radkowitsch, Claudius",2019,Nicht festgelegt,"Preprints, Working Paper und Forschungsberichte",,90,ICAE Working Paper Series,"Gräbner, C. (2019). Unrealistic models and how to identify them: on accounts of model realisticness. (ICAE Working Paper Series; Nr. 90)."
Defining institutions - A review and a synthesis,"Gräbner-Radkowitsch, Claudius",2019,Nicht festgelegt,"Preprints, Working Paper und Forschungsberichte",,89,ICAE Working Paper Series,"Gräbner, C., & Ghorbani, A. (2019). Defining institutions - A review and a synthesis. (ICAE Working Paper Series; Nr. 89)."
Marktfundamentalismus als Kollektivgedanke. Mises und die Ordoliberalen,"Pühringer, Stephan (+1 weitere)",2019,begutachtet,Beitrag in Buch/Bericht/Konferenzband,,,,"Ötsch, W., & Pühringer, S. (2019). Marktfundamentalismus als Kollektivgedanke. Mises und die Ordoliberalen. In Richard Sturn, Nenad Pantelic (Hrsg.), Dem Markt vertrauen? Beiträge zur Tiefenstruktur neoliberaler Regulierung. (S. 185-210). Metropolis. "
Was ist eine Krise? Ein Rückblick auf die Wirtschafts- und Finanzkrisen 2008 und 2010,"Pühringer, Stephan (+1 weitere)",2019,nicht begutachtet,Beitrag in Fachzeitschrift,,,,"Ötsch, W., & Pühringer, S. (2019). Was ist eine Krise? Ein Rückblick auf die Wirtschafts- und Finanzkrisen 2008 und 2010. Blickpunkt WISO."
From the ʻplanning euphoriaʼ to the ʻbitter economic truthʼ: The Transmission of economic ideas into German Labour Market Policies in the 1960s and 2000s,"Pühringer, Stephan (+1 weitere)",2020,begutachtet,Beitrag in Fachzeitschrift,,,,"Pühringer, S., & Griesser, M. (2020). From the ʻplanning euphoriaʼ to the ʻbitter economic truthʼ: The Transmission of economic ideas into German Labour Market Policies in the 1960s and 2000s. Critical Discourse Studies, 17(5), 476-493. https://doi.org/10.1080/17405904.2019.1681283"
Wirtschaftliche Polarisierung in Europa: Ursachen und Handlungsoptionen,"Kapeller, Jakob (+2 weitere)",2019,Nicht festgelegt,"Preprints, Working Paper und Forschungsberichte",,98,ICAE Working Paper Series,"Kapeller, J., Gräbner, C., & Heimberger, P. (2019). Wirtschaftliche Polarisierung in Europa: Ursachen und Handlungsoptionen. (ICAE Working Paper Series; Nr. 98)."
Die Budgetsemielastizität und ihre Auswirkungen auf Verschuldungsspielräume im Rahmen der Schuldenbremse,"Schütz, Bernhard (+1 weitere)",2022,begutachtet,Beitrag in Fachzeitschrift,,,,"Heimberger, P., & Schütz, B. (2022). Die Budgetsemielastizität und ihre Auswirkungen auf Verschuldungsspielräume im Rahmen der Schuldenbremse. Wirtschaftsdienst, 102(11), 834-837. https://doi.org/10.1007/s10273-022-3325-y"
The heterogeneous relationship between income and inequality: a panel co-integration approach,"Gräbner-Radkowitsch, Claudius",2019,begutachtet,Beitrag in Fachzeitschrift,,,,"Flechtner, S., & Gräbner, C. (2019). The heterogeneous relationship between income and inequality: a panel co-integration approach. Economics Bulletin, 39(4), 2540–2549."
What economics education is missing: The real world,"Bäuerle, Lukas (+1 weitere)",2018,Nicht festgelegt,"Preprints, Working Paper und Forschungsberichte",,37,Working Paper Serie ök,"Pühringer, S., & Bäuerle, L. (2018). What economics education is missing: The real world. (Working Paper Serie ök; Nr. 37)."
Die Krise als Katalysator für den Aufschwung des Rechtspopulismus,"Pühringer, Stephan",2018,nicht begutachtet,Andere Beiträge,,,,"Pühringer, S. (2018, Jul). Die Krise als Katalysator für den Aufschwung des Rechtspopulismus."
Wirtschaftliche Polarisierung in Europa: Ursachen und Handlungsoptionen,"Kapeller, Jakob (+2 weitere)",2019,Nicht festgelegt,"Preprints, Working Paper und Forschungsberichte",,,,"Kapeller, J., Gräbner, C., & Heimberger, P. (2019). Wirtschaftliche Polarisierung in Europa: Ursachen und Handlungsoptionen. Friedrich-Ebert Stiftung."
Beyond equilibrium: revisiting two-sided markets from an agent-based modelling perspective,"Gräbner-Radkowitsch, Claudius",2019,begutachtet,Beitrag in Fachzeitschrift,,,,"Heinrich, T., & Gräbner, C. (2019). Beyond equilibrium: revisiting two-sided markets from an agent-based modelling perspective. International Journal of Computational Economics and Econometrics, 9(3), 153-180. https://doi.org/10.1504/ijcee.2019.100558"
Freiheitliche Flügelkämpfe? (Historische) Konfliktlinien in der FPÖ,"Pühringer, Stephan (+1 weitere)",2018,begutachtet,Beitrag in Fachzeitschrift,,,,"Beyer, K., & Pühringer, S. (2018). Freiheitliche Flügelkämpfe? (Historische) Konfliktlinien in der FPÖ. Kurswechsel, (3), 19-27."
Krisenbilder von ÖkonomInnen in der Presse,"Pühringer, Stephan",2018,nicht begutachtet,Beitrag in Buch/Bericht/Konferenzband,,,,"Pühringer, S., & Egger, J. (2018). Krisenbilder von ÖkonomInnen in der Presse. In Walter Ötsch; Silja Graupe (Hrsg.), Macht der Bilder, Macht der Sprache (S. 75-86)"
What economics education is missing: the real world,"Bäuerle, Lukas (+1 weitere)",2019,begutachtet,Beitrag in Fachzeitschrift,,,,"Pühringer, S., & Bäuerle, L. (2019). What economics education is missing: the real world. International Journal of Social Economics, 46(8), 977-991. https://doi.org/10.1108/IJSE-04-2018-0221"
Ökonomische Expertise und polit-ökonomische Machtstrukturen,"Pühringer, Stephan",2018,nicht begutachtet,Beitrag in Buch/Bericht/Konferenzband,,,,"Pühringer, S., & Liedl, B. (2018). Ökonomische Expertise und polit-ökonomische Machtstrukturen. In AK Kärnten (Hrsg.), Welt aus den Fugen. Wie der Neoliberalismus unser Leben verändert. (S. 41-56). ÖGB Verlag. "
The Power of Scientometrics and the Development of Economics,"Aistleitner, Matthias (+2 weitere)",2018,begutachtet,Beitrag in Fachzeitschrift,,,,"Aistleitner, M., Kapeller, J., & Steinerberger, S. (2018). The Power of Scientometrics and the Development of Economics. Journal of Economic Issues, 52(3), 816-834. https://doi.org/10.1080/00213624.2018.1498721"
To trust or to control: Informal value transfer systems and computational analysis in institutional economics,"Gräbner-Radkowitsch, Claudius",2018,begutachtet,Beitrag in Fachzeitschrift,,,,"Gräbner, C., Elsner, W., & Lascaux, A. (2018). To trust or to control: Informal value transfer systems and computational analysis in institutional economics. Journal of Economic Issues, 52(2), 559-569. https://doi.org/10.1080/00213624.2018.1469936"
Die Macht der Wissenschaftsstatistik und die Entwicklung der Ökonomie,"Aistleitner, Matthias (+2 weitere)",2015,begutachtet,Beitrag in Buch/Bericht/Konferenzband,,,,"Aistleitner, M., Fölker, M., & Kapeller, J. (2015). Die Macht der Wissenschaftsstatistik und die Entwicklung der Ökonomie. In Momentum Kongress Paper (S. 1-21)"
Perspektiven für eine nachhaltige Automobilindustrie,"Aistleitner, Matthias",2016,begutachtet,Beitrag in Buch/Bericht/Konferenzband,,,,"Aistleitner, M. (2016). Perspektiven für eine nachhaltige Automobilindustrie. In Momentum Kongress Paper (S. 1-27)"
Citation Patterns in Economics and Beyond: Assessing the Peculiarities of Economics from Two Scientometric Perspectives,"Aistleitner, Matthias (+2 weitere)",2017,begutachtet,Beitrag in Buch/Bericht/Konferenzband,,,,"Aistleitner, M., Kapeller, J., & Steinerberger, S. (2017). Citation Patterns in Economics and Beyond: Assessing the Peculiarities of Economics from Two Scientometric Perspectives. In Momentum Kongress Paper (S. 1-22)"
Wachstum? Wohlstand und Lebensqualität!,"Griesser, Markus",2018,begutachtet,Beitrag in Fachzeitschrift,,,,"Griesser, M., & Brand, U. (2018). Wachstum? Wohlstand und Lebensqualität! Momentum Quarterly, 7(2), 53-72."
Warum die Volkswirtschaften der Eurozone den USA und Großbritannien seit der Finanzkrise hinterherhinken: Zur Rolle von Unterschieden in der Geld– und Fiskalpolitik,"Heimberger, Philipp",2016,nicht begutachtet,Beitrag in Fachzeitschrift,,,,"Heimberger, P. (2016). Warum die Volkswirtschaften der Eurozone den USA und Großbritannien seit der Finanzkrise hinterherhinken: Zur Rolle von Unterschieden in der Geld– und Fiskalpolitik. Studies Research Report, (5)."
MigrantInnen als Zielgruppe. Solidarische Beratungs- und Unterstützungsangebote von ArbeitnehmerInnenorganisationen in Österreich,"Griesser, Markus",2014,Nicht festgelegt,"Preprints, Working Paper und Forschungsberichte",,,Studie - Abschlussbericht,"Griesser, M., & Sauer, B. (2014). MigrantInnen als Zielgruppe. Solidarische Beratungs- und Unterstützungsangebote von ArbeitnehmerInnenorganisationen in Österreich. (Studie - Abschlussbericht). Universität, Institut für Politikwissenschaften."
Bestände und Konzentration privater Vermögen in Österreich,"Ferschli, Benjamin (+2 weitere)",2017,begutachtet,Beitrag in Fachzeitschrift,,,,"Kapeller, J., Ferschli, B., Schütz, B., & Wildauer, R. (2017). Bestände und Konzentration privater Vermögen in Österreich. Wirtschaft und Gesellschaft, 43(4), 499-534."
Wie viel bringt die Vermögenssteuer? Neue Aufkommensschätzungen für Österreich.,"Ferschli, Benjamin (+2 weitere)",2018,nicht begutachtet,Beitrag in Fachzeitschrift,,,,"Kapeller, J., Ferschli, B., Schütz, B., & Wildauer, R. (2018). Wie viel bringt die Vermögenssteuer? Neue Aufkommensschätzungen für Österreich. Wirtschafts- und Sozialwissenschaftliche Zeitschrift, 40(1), 146-160."
Editorial: Freie Fahrt für reiche Burschen? Schwarz-Blau ist zurück!,"Griesser, Markus (+1 weitere)",2018,Nicht festgelegt,Beitrag in Fachzeitschrift,,,,"Griesser, M., & Hofmann, J. (2018). Editorial: Freie Fahrt für reiche Burschen? Schwarz-Blau ist zurück! Kurswechsel, (3)."
