Titel,Personen,Jahr,Peer-Review erfolgt,Übergeordneter Typ,Serienvolumen,Seriennummer,Serienname,APA-Format
To build or not to build?,"Bäuerle, Lukas",2026,begutachtet,Beitrag in Fachzeitschrift,,,,"Sagvosdkin, V., Bäuerle, L., Semb, J., & Praetorius, B. (2026). To build or not to build? Sustainability narratives between growth-oriented ‘eco-markets’ and regulative ‘sufficiency’ in Germany's heat transition. Energy Research and Social Science, 131, 104527. Artikel 104527. https://doi.org/10.1016/j.erss.2025.104527"
Performative competition: The U.S. wireless communication market and the T-Mobile/Sprint merger,"Theine, Hendrik",2025,begutachtet,Beitrag in Fachzeitschrift,,,,"Popiel, P., Ali, C., Theine, H., & Forde, S. L. (2025). Performative competition: The U.S. wireless communication market and the T-Mobile/Sprint merger. International Communication Gazette. Vorzeitige Online-Publikation. https://doi.org/10.1177/17480485251405601"
Reappraising consumption nudging—on liberty in the age of climate catastrophe,"Kapeller, Jakob",2025,begutachtet,Beitrag in Fachzeitschrift,,,,"Braganza, O., & Kapeller, J. (2025). Reappraising consumption nudging—on liberty in the age of climate catastrophe. Humanities and Social Sciences Communications, 12(1), Artikel 251. https://doi.org/10.1057/s41599-024-04246-0"
Informing Philadelphia - Strengths and Gaps in Local Media’s Coverage of Critical Information Needs,"Verita, Carlotta (+1 weitere)",2025,Nicht festgelegt,"Preprints, Working Paper und Forschungsberichte",,,,"Theine, H., & Verita, C. (2025). Informing Philadelphia - Strengths and Gaps in Local Media’s Coverage of Critical Information Needs. https://www.asc.upenn.edu/sites/default/files/2025-09/Informing%20Philadelphia%20White%20Paper.pdf"
Outsourcing Domestic Work in the Crisis of Social Reproduction: Platform-Mediated Cleaning and the Role of Clients,"Sardadvar, Karin (+2 weitere)",2025,begutachtet,Beitrag in Fachzeitschrift,,,,"Gerold, S., Gruszka, K., Sardadvar, K., & Theine, H. et al. (2025). Outsourcing Domestic Work in the Crisis of Social Reproduction: Platform-Mediated Cleaning and the Role of Clients. New Technology, Work and Employment, 1-12. Vorzeitige Online-Publikation. https://doi.org/10.1111/ntwe.70015"
Kapitel 20. Mediendiskurse und -strukturen,"Theine, Hendrik",2023,begutachtet,Beitrag in Buch/Bericht/Konferenzband,,,,"Theine, H., & Regen, L. (2023). Kapitel 20. Mediendiskurse und -strukturen. In C. Görg, V. Madner, A. Muhar, A. Novy, A. Posch, K. W. Steininger, & E. Aigner (Hrsg.), APCC Special Report: Strukturen für ein klimafreundliches Leben (S. 547–566). Springer. https://doi.org/10.1007/978-3-662-66497-1_24"
Kapitel 10: Integrierte Perspektiven auf Strukturbedingungen,"Theine, Hendrik (+1 weitere)",2023,begutachtet,Beitrag in Buch/Bericht/Konferenzband,,,,"Ornetzeder, M., Pichler, M., Madner, V., & Görg, C. et al. (2023). Kapitel 10: Integrierte Perspektiven auf Strukturbedingungen. In C. Görg, V. Madner, A. Muhar, A. Novy, A. Posch, K. W. Steininger, & E. Aigner (Hrsg.), APCC Special Report: Strukturen für ein klimafreundliches Leben (1 Aufl., S. 347-349). Springer Spektrum. https://doi.org/10.1007/978-3-662-66497-1_14"
Unterschätzte Synergien zwischen Vermögensbesteuerung und Klimawandelanpassung,"Theine, Hendrik",2025,nicht begutachtet,Beitrag in Fachzeitschrift,,,,"Teebken, J., Klüh, U., Kleinod, S., & Theine, H. (2025). Unterschätzte Synergien zwischen Vermögensbesteuerung und Klimawandelanpassung: Klimapolitik: Drei Fliegen mit einer Klappe. Ökologisches Wirtschaften, 40(4), 45-50. https://doi.org/10.14512/OEW400445"
Die Medienberichterstattung zur Vermögens- und Erbschaftsbesteuerung in Deutschland,"Theine, Hendrik",2022,begutachtet,Beitrag in Fachzeitschrift,,,,"Theine, H., & Grisold, A. (2022). Die Medienberichterstattung zur Vermögens- und Erbschaftsbesteuerung in Deutschland. Zeitschrift für Politikwissenschaft, 32(1). https://doi.org/10.1007/s41358-022-00314-6"
"Media, Telecommunication, and Internet Concentration in Germany 2019-2023","Theine, Hendrik",2025,Nicht festgelegt,"Preprints, Working Paper und Forschungsberichte",,,Global Media and Internet Concentration Project,"Barbutev, L., Theine, H., Mast, T., & Spannuth, J. S. (2025). Media, Telecommunication, and Internet Concentration in Germany 2019-2023. (Global Media and Internet Concentration Project). https://doi.org/10.22215/gmicp/2025.12.276"
“The Charm of Emission Trading”: Ideas of German Economists on Economic Policy in Times of Crises,"Porak, Laura",2025,begutachtet,Beitrag in Fachzeitschrift,,,,"Reinke, R., & Porak, L. (2025). “The Charm of Emission Trading”: Ideas of German Economists on Economic Policy in Times of Crises. Journal of Economic Issues, 59(4), 1191-1211. https://doi.org/10.1080/00213624.2025.2575141"
Economic Ideas Across Borders,"Kapeller, Jakob",2025,begutachtet,Buch,,,Routledge Studies in the History of Economics,"Kapeller, J., & Özgür, M. E. (Hrsg.) (2025). Economic Ideas Across Borders: A History of German Influence on Turkish Economics. (1 Aufl.) (Routledge Studies in the History of Economics). Routledge. https://doi.org/10.4324/9781003622000"
From monoculture to pluricultures.,"Bäuerle, Lukas",2025,begutachtet,Beitrag in Buch/Bericht/Konferenzband,,,,"Bäuerle, L., & Groenewald, M. M. (2025). From monoculture to pluricultures. Recent trends in economic education. In The Routledge Handbook of Heterodox Economics: Volume 2: Dynamics and Alternatives (2 Aufl., Band 2, S. 353-368). Routledge Taylor & Francis Group. https://doi.org/10.4324/9781003687054-28"
Gleichstellung in der sozial-ökologischen Transformation,"Kapeller, Jakob",2025,Nicht festgelegt,"Preprints, Working Paper und Forschungsberichte",,,,Sachverständigenkommission für den Vierten Gleichstellungsbericht der Bundesregierung (2025). Gleichstellung in der sozial-ökologischen Transformation: Gutachten für den Vierten Gleichstellungsbericht der Bundesregierung. Bundesstiftung Gleichstellung. https://www.gleichstellungsbericht.de/wp-content/uploads/2025/04/GutachtenVierterGleichstellungsbericht_WEB_20250303_bf_V2.pdf
Die klassische ökonomische Verhaltenstheorie und ihre Grenzen,"Kapeller, Jakob",2024,begutachtet,Beitrag in Buch/Bericht/Konferenzband,,,,"Kapeller, J. (2024). Die klassische ökonomische Verhaltenstheorie und ihre Grenzen. In Wirtschaft plural: Perspektiven Pluraler Ökonomik in der politischen Bildung Bundeszentrale für politische Bildung. https://www.bpb.de/system/files/dokument_pdf/TuM_Wirtschaft_plural_Handreichung.pdf"
The Global Perspective on Income Inequality,"Kapeller, Jakob",2025,begutachtet,Beitrag in Buch/Bericht/Konferenzband,329,,Studies in Critical Social Sciences,"Guerriero, A. Z., & Kapeller, J. (2025). The Global Perspective on Income Inequality. In Global Inequality: Rethinking Sociology in the 21st Century (1 Aufl., S. 69-95). (Studies in Critical Social Sciences; Band 329). Brill. https://doi.org/10.1163/9789004733626_004"
From monoculture to pluricultures,"Bäuerle, Lukas",2025,Nicht festgelegt,"Preprints, Working Paper und Forschungsberichte",,172,ICAE Working Paper Series,"Bäuerle, L., & Groenewald, M. M. (2025). From monoculture to pluricultures: Recent trends in economics education. (ICAE Working Paper Series; Nr. 172). https://www.jku.at/fileadmin/gruppen/108/ICAE_Working_Papers/wp172.pdf"
The Economics of Socio-Ecological Transformations,"Bäuerle, Lukas (+1 weitere)",2025,Nicht festgelegt,"Preprints, Working Paper und Forschungsberichte",,171,ICAE Working Paper Series,"Pühringer, S., & Bäuerle, L. (2025). The Economics of Socio-Ecological Transformations: A conceptual framework. (ICAE Working Paper Series; Nr. 171). https://www.jku.at/fileadmin/gruppen/108/ICAE_Working_Papers/wp171.pdf"
Political Economy of Knowledge Production in Capitalist Academia: Challenges and Opportunities for Socio-Ecological Transformation,"Hager, Theresa (+2 weitere)",2025,Nicht festgelegt,"Preprints, Working Paper und Forschungsberichte",,,ICAE Working Paper Series,"Altreiter, C., Hager, T., & Pühringer, S. (2025). Political Economy of Knowledge Production in Capitalist Academia: Challenges and Opportunities for Socio-Ecological Transformation. (ICAE Working Paper Series). https://www.jku.at/fileadmin/gruppen/108/ICAE_Working_Papers/wp164.pdf"
"“We need long-term thinking, predictability, and reliability.”","Bäuerle, Lukas",2026,begutachtet,Beitrag in Fachzeitschrift,,,,"Bäuerle, L., Barkey, M., Sagvosdkin, V., & Semb, J. (2026). “We need long-term thinking, predictability, and reliability.”: Imagined futures of the German heating and housing transition. Futures, 175, Artikel 103736. https://doi.org/10.1016/j.futures.2025.103736"
On the Impact of the Trump Administration on Media and Media Regulation in Europe,"Theine, Hendrik",2025,begutachtet,Beitrag in Fachzeitschrift,,,,"Tröger, M., & Theine, H. (2025). On the Impact of the Trump Administration on Media and Media Regulation in Europe. Journalism Research, 8(1), 94-106. https://doi.org/10.1453/2569-152X-12025-15004-en"
Communication about economic inequality: a systematic review,"Theine, Hendrik",2025,begutachtet,Beitrag in Fachzeitschrift,,,,"Vaughan, M., Theine, H., Schieferdecker, D., & Waitkus, N. (2025). Communication about economic inequality: a systematic review. Annals of the International Communication Association, 49(3), 147-158. https://doi.org/10.1093/anncom/wlaf006"
"Über Reichtum berichten. Der ""Gute Rat für Rückverteilung"" in den Medien","Verita, Carlotta (+1 weitere)",2025,Nicht festgelegt,"Preprints, Working Paper und Forschungsberichte",,79,OSB-Arbeitspapier,"Theine, H., Verita, C., & Gartiser, M. (2025). Über Reichtum berichten. Der ""Gute Rat für Rückverteilung"" in den Medien. (OSB-Arbeitspapier; Nr. 79). https://www.otto-brenner-stiftung.de/ueber-reichtum-berichten/"
Ungleichheiten in der grünen Transformation: Die prädistributive Macht von Infrastrukturen,"Terhorst, Carlotta",2025,begutachtet,Beitrag in Fachzeitschrift,,,,"Wansleben, L., & Terhorst, C. (2025). Ungleichheiten in der grünen Transformation: Die prädistributive Macht von Infrastrukturen. Zeitschrift für Soziologie, 54(3), 342-361. https://doi.org/10.1515/zfsoz-2025-2023"
Gender Norms and Network Structure: A Model of the Intrahousehold Division of Labor,"Hager, Theresa",2025,begutachtet,Beitrag in Fachzeitschrift,,,,"Hager, T., Mellacher, P., & Rath, M. (2025). Gender Norms and Network Structure: A Model of the Intrahousehold Division of Labor. Feminist Economics, 31(3), 237-274. https://doi.org/10.1080/13545701.2025.2549406"
Transforming Economics from the Side Lane?,"Bäuerle, Lukas",2025,Nicht festgelegt,"Preprints, Working Paper und Forschungsberichte",,170,ICAE Working Paper Series,"Bäuerle, L., & Maasen, S. (2025). Transforming Economics from the Side Lane? The New Economy Space and its Thinktanks. (ICAE Working Paper Series; Nr. 170). https://www.jku.at/fileadmin/gruppen/108/ICAE_Working_Papers/wp170.pdf"
Theorizing competition,"Pühringer, Stephan (+2 weitere)",2025,begutachtet,Beitrag in Fachzeitschrift,,,,"Altreiter, C., Gräbner-Radkowitsch, C., Pühringer, S., & Rogojanu, A. et al. (2025). Theorizing competition: An interdisciplinary framework. Competition & Change, 29(5), 593-614. https://doi.org/10.1177/10245294251330343"
“Taxing the Palaces”,"Theine, Hendrik",2025,begutachtet,Beitrag in Fachzeitschrift,,,,"Drahoss, E., & Theine, H. (2025). “Taxing the Palaces”: Dissecting the Media Discourse of Red Vienna’s Wealth Tax Policy. Journalism History. Vorzeitige Online-Publikation. https://doi.org/10.1080/00947679.2025.2540342"
Mobilitätswende produzieren – Eine Allianz für den europäischen Bahnausbau schaffen,"Eder, Julia Theresa",2025,Nicht festgelegt,Beitrag in populärwissenschaftlicher Zeitschrift,,,,"Eder, J. (2025). Mobilitätswende produzieren – Eine Allianz für den europäischen Bahnausbau schaffen. EU-Infobrief, 2025(3), 18-25. https://emedien.arbeiterkammer.at/viewer/image/AC05712646_2025_3/18/#topDocAnchor"
Greening the European economy at the expense of other world regions?,"Eder, Julia Theresa",2025,Nicht festgelegt,"Preprints, Working Paper und Forschungsberichte",168,,ICAE Working Paper,"Eder, J., & Rammer, J. (2025). Greening the European economy at the expense of other world regions? Tracing the EU's quest for green hydrogen in Chile. (ICAE Working Paper; Band 168). https://www.jku.at/fileadmin/gruppen/108/ICAE_Working_Papers/wp168.pdf"
Gemeinwohl oder Privateigentum? Die Positionen der deutschsprachigen Presse in der Debatte über eine Freigabe der Corona-Impfstoffpatente,"Theine, Hendrik",2025,begutachtet,Beitrag in Fachzeitschrift,,,,"Polkowski, J., Theine, H., & Krüger, U. (2025). Gemeinwohl oder Privateigentum? Die Positionen der deutschsprachigen Presse in der Debatte über eine Freigabe der Corona-Impfstoffpatente. Studies in Communication and Media, 14(2), 234-260. https://doi.org/10.5771/2192-4007-2025-2-234"
Netz­wer­ke der Super­rei­chen:,"Hieselmayr, Sophie (+3 weitere)",2024,begutachtet,Beitrag in Fachzeitschrift,,,,"Cserjan, L., Hieselmayr, S., Aistleitner, M., & Pühringer, S. (2024). Netz­wer­ke der Super­rei­chen: Zur poli­ti­schen Öko­no­mie der Ver­mö­gens­kon­zen­tra­ti­on in Österreich. Kurswechsel, 2024(3). https://www.beigewum.at/kurswechsel/netzwerke-der-superreichen-zur-politischen-oekonomie-der-vermoegenskonzentration-in-oesterreich/"
Die Bereitstellung von leistbarem Wohnraum in Zeiten der Wohnkrise,"Altreiter, Carina",2023,begutachtet,Beitrag in Fachzeitschrift,,,,"Litschauer, K., Kumnig, S., Kohout, R., & Wolfmayr, G. et al. (2023). Die Bereitstellung von leistbarem Wohnraum in Zeiten der Wohnkrise: Deutungen und Praktiken der Wiener Gemeinnützigkeit. DISP, 59(3), 33-49. https://doi.org/10.1080/02513625.2023.2288448"
Strategies of Capital Accumulation in Times of Land Scarcity. A Field Perspective on Social Housing Construction in Vienna,"Altreiter, Carina",2024,begutachtet,Beitrag in Fachzeitschrift,,,,"Altreiter, C., & Litschauer, K. (2024). Strategies of Capital Accumulation in Times of Land Scarcity. A Field Perspective on Social Housing Construction in Vienna. Forum for Social Economics, 53(2), 216-232. https://doi.org/10.1080/07360932.2022.2125423"
Die EU zwischen strategischer Autonomie und Unterordnung unter die USA,"Porak, Laura (+1 weitere)",2025,Nicht festgelegt,"Preprints, Working Paper und Forschungsberichte",165,,ICAE Working Papers,"Eder, J., & Porak, L. (2025). Die EU zwischen strategischer Autonomie und Unterordnung unter die USA. (ICAE Working Papers; Band 165)."
Mobilitätswende produ­zieren: Warum die Bahn­industrie jetzt im Zentrum stehen muss,"Eder, Julia Theresa (+2 weitere)",2025,Nicht festgelegt,Elektronische/multimediale Veröffentlichungen,,,,"Eder, J., Pühringer, S., & Cserjan, L. (2025). Mobilitätswende produ­zieren: Warum die Bahn­industrie jetzt im Zentrum stehen muss. Blog Beitrag"
Die EU zwischen strategischer Autonomie und Unterordnung unter die USA,"Porak, Laura (+1 weitere)",2025,nicht begutachtet,Beitrag in Buch/Bericht/Konferenzband,,,,"Eder, J., & Porak, L. (im Druck). Die EU zwischen strategischer Autonomie und Unterordnung unter die USA. In Multiple Krise und neue Konstellationen des Kapitalismus: Elemente einer Bestandsaufnahme (1 Aufl.). Verlag Westfälisches Dampfboot. "
Greening the European economy at the expense of other world regions? Tracing the EU’s quest for green hydrogen in Chile,"Eder, Julia Theresa",2025,begutachtet,Beitrag in Buch/Bericht/Konferenzband,,,,"Eder, J., & Rammer, J. (2025). Greening the European economy at the expense of other world regions? Tracing the EU’s quest for green hydrogen in Chile. In Critical Political Economy of the European Polycrisis (1 Aufl., S. 209-224). Edward Elgar Publishing. https://doi.org/10.4337/9781035347940_14"
"“We Need Long-Term Thinking, Predictability, and Reliability”","Bäuerle, Lukas",2025,Nicht festgelegt,"Preprints, Working Paper und Forschungsberichte",,,,"Bäuerle, L., Barkey, M., Sagvosdkin, V., & Semb, J. (2025). “We Need Long-Term Thinking, Predictability, and Reliability”: Imagined Futures of the German Heating and Housing Transition. https://doi.org/10.2139/ssrn.5180335"
System-induced transition inertia in the transformation of the German heating and housing sector,"Bäuerle, Lukas",2025,Nicht festgelegt,"Preprints, Working Paper und Forschungsberichte",,,,"Semb, J., Bäuerle, L., & Sagvosdkin, V. (2025). System-induced transition inertia in the transformation of the German heating and housing sector. https://doi.org/10.2139/ssrn.5406252"
„Der Weg zur Zerstörung ist mit guten Absichten gepflastert.”,"Kreissl, Katharina (+1 weitere)",2025,begutachtet,Beitrag in Fachzeitschrift,,,,"Hofbauer, J., Kreissl, K., & Pühringer, S. (2025). „Der Weg zur Zerstörung ist mit guten Absichten gepflastert.”: Über die ökonomischen, sozialen und epistemischen Kosten von Reformen im Wissenschafts- und Universitätssystem. Kurswechsel, (2), 12-22."
Displacing ordoliberalism in favour of EU sovereignty: An analysis of green EU industrial policy from a Cultural Political Economy perspective,"Porak, Laura",2025,begutachtet,Beitrag in Fachzeitschrift,,,,"Porak, L. (2025). Displacing ordoliberalism in favour of EU sovereignty: An analysis of green EU industrial policy from a Cultural Political Economy perspective. Der moderne Staat, 18(1), 17-34. https://doi.org/10.3224/dms.v18i1.02"
On the Nexus of Economic Knowledge Production and Expertise in Policymaking,"Porak, Laura",2025,begutachtet,Beitrag in Fachzeitschrift,,,,"Reinke, R., & Porak, L. (2025). On the Nexus of Economic Knowledge Production and Expertise in Policymaking. Historical Social Research, 50(2), 376-404. https://doi.org/10.12759/hsr.50.2025.28"
Vermögensverteilung in Österreich: Eine Analyse auf Basis des HFCS 2021/22,"Hornykewycz, Anna (+1 weitere)",2024,Nicht festgelegt,"Preprints, Working Paper und Forschungsberichte",,,Materialien zu Wirtschaft und Gesellschaft - Working Paper-Reihe der AK Wien,"Heck, I., Hornykewycz, A., Kapeller, J., & Wildauer, R. (2024). Vermögensverteilung in Österreich: Eine Analyse auf Basis des HFCS 2021/22. (1 Aufl.) (S. 1-34). (Materialien zu Wirtschaft und Gesellschaft - Working Paper-Reihe der AK Wien). https://emedien.arbeiterkammer.at/viewer/image/AC17296950/"
Idiosyncrasies of the superrich: On the political economy of wealth concentration in Austria,"Aistleitner, Matthias (+3 weitere)",2024,Nicht festgelegt,"Preprints, Working Paper und Forschungsberichte",,,Materialien zu Wirtschaft und Gesellschaft - Working Paper-Reihe der AK Wien,"Pühringer, S., Aistleitner, M., Cserjan, L., & Hieselmayr, S. et al. (2024). Idiosyncrasies of the superrich: On the political economy of wealth concentration in Austria. (Materialien zu Wirtschaft und Gesellschaft - Working Paper-Reihe der AK Wien). https://emedien.arbeiterkammer.at/viewer/image/AC17367868/"
Networks of the super-rich in Austria. Evidence from an explorative case study,"Aistleitner, Matthias (+2 weitere)",2022,Nicht festgelegt,"Preprints, Working Paper und Forschungsberichte",,,Materialien zu Wirtschaft und Gesellschaft - Working Paper-Reihe der AK Wien,"Pühringer, S., Aistleitner, M., & Griesebner, T. (2022). Networks of the super-rich in Austria. Evidence from an explorative case study. (Materialien zu Wirtschaft und Gesellschaft -  Working Paper-Reihe der AK Wien). https://emedien.arbeiterkammer.at/viewer/image/AC16689081/"
Bestände und Konzentration privater Vermögen in Österreich,"Ferschli, Benjamin (+2 weitere)",2017,Nicht festgelegt,"Preprints, Working Paper und Forschungsberichte",,,Materialien zu Wirtschaft und Gesellschaft - Working Paper-Reihe der AK Wien,"Kapeller, J., Ferschli, B., Schütz, B., & Wildauer, R. (2017). Bestände und Konzentration privater Vermögen in Österreich. (167 Aufl.) (Materialien zu Wirtschaft und Gesellschaft - Working Paper-Reihe der AK Wien)."
Politiken der Verwettbewerblichung: Einblicke ins im österreichischen Wissenschaftssystem und darüber hinaus.,"Pühringer, Stephan (+1 weitere)",2024,nicht begutachtet,Beitrag in Buch/Bericht/Konferenzband,,,,"Altreiter, C., Pühringer, S., & Völkl, Y. (2024). Politiken der Verwettbewerblichung: Einblicke ins im österreichischen Wissenschaftssystem und darüber hinaus. In BdWi (Hrsg.), Umkämpfte Wissenschaftsfreiheit – Verhältnis von Wissenschaft & Politik: 14. Studienheft des Bundes demokratischer Wissenschaftlerinnen und Wissenschaftler (Band 14, S. 29-32)"
Development models in the EU: opportunities and challenges,"Kapeller, Jakob (+1 weitere)",2024,begutachtet,Beitrag in Buch/Bericht/Konferenzband,,,,"Kapeller, J., & Gräbner-Radkowitsch, C. (2024). Development models in the EU: opportunities and challenges. In U. Glassmann, & C. Gräbner-Radkowitsch (Hrsg.), Jahrbuch Ökonomie und Gesellschaft (Band 35, S. 49-80)"
Mobilitätswende produzieren,"Porak, Laura (+4 weitere)",2025,Nicht festgelegt,"Preprints, Working Paper und Forschungsberichte",,162,ICAE Working Paper Series,"Cserjan, L., Eder, J. T., Hornykewycz, A., & Porak, L. et al. (2025). Mobilitätswende produzieren: Produktionsbedingungen der österreichischen Bahnindustrie und industrielle Potenziale durch den Ausbau des öffentlichen Verkehrs. (ICAE Working Paper Series; Nr. 162). https://www.jku.at/fileadmin/gruppen/108/ICAE_Working_Papers/wp162.pdf"
Trends in economic inequality and news mediascape,"Theine, Hendrik",2020,nicht begutachtet,Beitrag in Buch/Bericht/Konferenzband,,,,"Theine, H., & Grabner, D. (2020). Trends in economic inequality and news mediascape. In Economic Inequality and News Media: Discourse, Power, and Redistribution (S. 21-47). Oxford University Press. https://doi.org/10.1093/oso/9780190053901.003.0002"
"Stagnation, social tensions, unfairness. Economic inequality as a problem","Theine, Hendrik",2020,nicht begutachtet,Beitrag in Buch/Bericht/Konferenzband,,,,"Grabner, D., Grisold, A., & Theine, H. (2020). Stagnation, social tensions, unfairness. Economic inequality as a problem. In Economic Inequality and News Media: Discourse, Power, and Redistribution (S. 144-168). Oxford University Press. https://doi.org/10.1093/oso/9780190053901.003.0008"
Voluntary individual carbon trading. Friend or foe?,"Theine, Hendrik",2018,begutachtet,Beitrag in Buch/Bericht/Konferenzband,,,,"Spash, C. L., & Theine, H. (2018). Voluntary individual carbon trading. Friend or foe? In The Cambridge Handbook of Psychology and Economic Behaviour, Second Edition (S. 595-624). Cambridge University Press 2005. https://doi.org/10.1017/9781316676349.021"
"“Now, What Exactly is the Problem?“ Media Coverage of Economic Inequalities and Redistribution Policies. The Piketty Case","Theine, Hendrik",2020,begutachtet,Beitrag in Fachzeitschrift,,,,"Grisold, A., & Theine, H. (2020). “Now, What Exactly is the Problem?“ Media Coverage of Economic Inequalities and Redistribution Policies. The Piketty Case. Journal of Economic Issues, 54(4), 1071-1094. https://doi.org/10.1080/00213624.2020.1829905"
Debating inequality: The case of Piketty's capital in the 21st century,"Theine, Hendrik",2022,nicht begutachtet,Beitrag in Buch/Bericht/Konferenzband,,,,"Grisold, A., & Theine, H. (2022). Debating inequality: The case of Piketty's capital in the 21st century. In The Media and Inequality (S. 176-191). Taylor and Francis. https://doi.org/10.4324/9781003104476-16"
Media and economic inequality: Review of prior research,"Theine, Hendrik",2020,nicht begutachtet,Beitrag in Buch/Bericht/Konferenzband,,,,"Grisold, A., & Theine, H. (2020). Media and economic inequality: Review of prior research. In Economic Inequality and News Media: Discourse, Power, and Redistribution (S. 70-88). Oxford University Press. https://doi.org/10.1093/oso/9780190053901.003.0004"
Integrating environmental issues within party manifestos. Exploring trends across European welfare states,"Theine, Hendrik",2022,begutachtet,Beitrag in Buch/Bericht/Konferenzband,,,,"Derndorfer, J., Hoffmann, R., & Theine, H. (2022). Integrating environmental issues within party manifestos. Exploring trends across European welfare states. In Towards Sustainable Welfare States in Europe (S. 80-107). Edward Elgar Publishing Ltd.. "
Is this feasible? Policy proposals such as a global wealth tax,"Theine, Hendrik",2020,nicht begutachtet,Beitrag in Buch/Bericht/Konferenzband,,,,"Grisold, A., Rieder, M., & Theine, H. (2020). Is this feasible? Policy proposals such as a global wealth tax. In Economic Inequality and News Media: Discourse, Power, and Redistribution (S. 169-188). Oxford University Press. https://doi.org/10.1093/oso/9780190053901.003.0009"
"‘Piketty is a genius, but … ’","Theine, Hendrik",2019,begutachtet,Beitrag in Fachzeitschrift,,,,"Rieder, M., & Theine, H. (2019). ‘Piketty is a genius, but … ’: an analysis of journalistic delegitimation of Thomas Piketty’s economic policy proposals. Critical Discourse Studies, 16(3), 248-263. https://doi.org/10.1080/17405904.2019.1573148"
Media coverage of economic inequality,"Theine, Hendrik",2020,begutachtet,Beitrag in Buch/Bericht/Konferenzband,,,,"Rieder, M., Silke, H., & Theine, H. (2020). Media coverage of economic inequality: The empirical study-an initial overview. In Economic Inequality and News Media: Discourse, Power, and Redistribution (S. 106-123). Oxford University Press. https://doi.org/10.1093/oso/9780190053901.003.0006"
