Titel,Personen,Jahr,Peer-Review erfolgt,Übergeordneter Typ,Serienvolumen,Seriennummer,Serienname,APA-Format
Heterodoxie in der Ökonomik,"Hirte, Katrin",2018,begutachtet,Beitrag in Buch/Bericht/Konferenzband,,,,"Hirte, K., & Thieme, S. (2018). Heterodoxie in der Ökonomik. In Schetsche, Michael; Schmied-Knittel, Ina (Hrsg.), Heterodoxie. Konzepte, Traditionen, Figuren der Abweichung Halem Verlag. "
Die deutsche Agrarpolitik und Agrarökonomik. Entstehung und Wandel zweier ambivalenter Disziplinen,"Hirte, Katrin",2019,nicht begutachtet,Buch,,,,"Hirte, K. (2019). Die deutsche Agrarpolitik und Agrarökonomik. Entstehung und Wandel zweier ambivalenter Disziplinen. Springer."
Delayed by outsourcing? Zur Stabilität des Kapitalismus im 21. Jahrhundert (Doppelrezension),"Kapeller, Jakob",2017,Nicht festgelegt,Beitrag in Fachzeitschrift,,,,"Kapeller, J. (2017). Delayed by outsourcing? Zur Stabilität des Kapitalismus im 21. Jahrhundert (Doppelrezension). Soziologische Revue, 40(4), 547–555. https://doi.org/10.1515/srsr-2017-0072"
From paradigms to policies: Economic models in the EU’s fiscal regulation framework,"Kapeller, Jakob (+1 weitere)",2017,Nicht festgelegt,"Preprints, Working Paper und Forschungsberichte",,61,ICAE Working Paper Series,"Huber, J., Heimberger, P., & Kapeller, J. (2017). From paradigms to policies: Economic models in the EU’s fiscal regulation framework. (ICAE Working Paper Series; Nr. 61)."
Wirtschaftspolitische Ausrichtung österreichischer Parteien im historischen Verlauf. Die Ausgestaltung österreichischer Parteiprogrammatiken unter dem Einfluss neoliberalen Gedankenguts,"Grimm, Christian",2015,Nicht festgelegt,Abschlussarbeiten,,,,"Grimm, C. (2015). Wirtschaftspolitische Ausrichtung österreichischer Parteien im historischen Verlauf. Die Ausgestaltung österreichischer Parteiprogrammatiken unter dem Einfluss neoliberalen Gedankenguts."
Die Rolle des Gleichgewichtskonzepts in der mikroökonomischen Ausbildung,"Gräbner-Radkowitsch, Claudius",2017,begutachtet,Beitrag in Buch/Bericht/Konferenzband,,,,"Gräbner, C. (2017). Die Rolle des Gleichgewichtskonzepts in der mikroökonomischen Ausbildung. In Till van Treek, Janina Urban (Hrsg.), Wirtschaft neu denken (S. 60-73). iRIGHTS media. "
Policy Implications of Recent Advances in Evolutionary and Institutional Economics,"Gräbner-Radkowitsch, Claudius",2016,nicht begutachtet,Buch,,,,"Gräbner, C., Heinrich, T., & Schwardt, H. (Hrsg.) (2016). Policy Implications of Recent Advances in Evolutionary and Institutional Economics. Routledge."
"Rezension von „Monika Burmester, Emma Dowling & Norbert Wohlfahrt (Hg.) (2017): Privates Kapital für soziale Dienste? Wirkungsorientiertes Investment und seine Folgen für die Soziale Arbeit“","Griesser, Markus",2017,Nicht festgelegt,Beitrag in Fachzeitschrift,,,,"Griesser, M. (2017). Rezension von „Monika Burmester, Emma Dowling & Norbert Wohlfahrt (Hg.) (2017): Privates Kapital für soziale Dienste? Wirkungsorientiertes Investment und seine Folgen für die Soziale Arbeit“. Soziales Kapital, 264-267."
Images and imaginaries of unemployed people. Discursive shifts in the transition from active to activating labour market policies in Germany,"Griesser, Markus",2017,begutachtet,Beitrag in Fachzeitschrift,,,,"Griesser, M. (2017). Images and imaginaries of unemployed people. Discursive shifts in the transition from active to activating labour market policies in Germany. Critical Social Policy, (2), [online first]. https://doi.org/10.1177/0261018317727481"
Von der sozialen Neuzusammensetzung zur gewerkschaftlichen Erneuerung? MigrantInnen als Zielgruppe der österreichischen Gewerkschaftsbewegung,"Griesser, Markus",2017,begutachtet,Beitrag in Fachzeitschrift,,,,"Griesser, M., & Sauer, B. (2017). Von der sozialen Neuzusammensetzung zur gewerkschaftlichen Erneuerung? MigrantInnen als Zielgruppe der österreichischen Gewerkschaftsbewegung. ÖZS - Österreichische Zeitschrift für Soziologie, (2), 147-166. https://doi.org/10.1007/s11614-017-0262-x"
The NAIRU determinants: what’s structural about unemployment in Europe?,"Kapeller, Jakob (+2 weitere)",2017,begutachtet,Beitrag in Fachzeitschrift,,,,"Heimberger, P., Kapeller, J., & Schütz, B. (2017). The NAIRU determinants: what’s structural about unemployment in Europe? Journal of Policy Modeling, 39(5), 883-908. https://doi.org/10.1016/j.jpolmod.2017.04.003"
Was denken (zukünftige) ÖkonomInnen?: Einblicke in die politische und gesellschaftliche Wirkmächtigkeit ökonomischen Denkens.,"Bäuerle, Lukas (+1 weitere)",2017,begutachtet,Beitrag in Fachzeitschrift,,,,"Pühringer, S., Bäuerle, L., & Engarntner, T. (2017). Was denken (zukünftige) ÖkonomInnen?: Einblicke in die politische und gesellschaftliche Wirkmächtigkeit ökonomischen Denkens. GWP - Gesellschaft, Wirtschaft, Politik, 66(4), 547-556."
The success story of ordoliberalism as guiding principle of German economic policy,"Pühringer, Stephan",2017,begutachtet,Beitrag in Buch/Bericht/Konferenzband,,,,"Pühringer, S. (2017). The success story of ordoliberalism as guiding principle of German economic policy. In Hien, Josef; Joerges, Christian (Hrsg.), Ordoliberalism. Law and the rule of economics (S. 134-158). Hart Publishing. "
"Zunehmende Ungleichheit der Vermögensverteilung: Rezension von Michael Schneider, Mike Pottenger und John E. King „The Distribution of Wealth – Growing Inequality?“","Schütz, Bernhard",2017,Nicht festgelegt,Beitrag in Fachzeitschrift,,,,"Schütz, B. (2017). Zunehmende Ungleichheit der Vermögensverteilung: Rezension von Michael Schneider, Mike Pottenger und John E. King „The Distribution of Wealth – Growing Inequality?“. Wirtschaft und Gesellschaft, 43(3), 449-451."
The Micro-Macro Link in Heterodox Economics,"Kapeller, Jakob (+1 weitere)",2017,begutachtet,Beitrag in Buch/Bericht/Konferenzband,,,,"Gräbner, C., & Kapeller, J. (2017). The Micro-Macro Link in Heterodox Economics. In Tae-Hee Jo, Lynne Chester Carlo and D'Ippoliti (Hrsg.), The Routledge Handbook of Heterodox Economics (S. 145-159). Routledge. https://doi.org/10.4324/9781315707587.ch10"
Intangible Flow Theory: A New Way for Conceptualizing Embeddedness?,"Kapeller, Jakob",2021,begutachtet,Beitrag in Fachzeitschrift,,,,"Kapeller, J. (2021). Intangible Flow Theory: A New Way for Conceptualizing Embeddedness? Accounting, Economics and Law, 14(1), 159-164."
The Complementary Relationship Between Institutional and Complexity Economics: The Example of Deep Mechanismic Explanations,"Gräbner-Radkowitsch, Claudius",2017,begutachtet,Beitrag in Fachzeitschrift,,,,"Gräbner, C. (2017). The Complementary Relationship Between Institutional and Complexity Economics: The Example of Deep Mechanismic Explanations. Journal of Economic Issues, 51(2), 392-400. https://doi.org/10.1080/00213624.2017.1320915"
Netzwerke des Marktes : Ordoliberalismus als Politische Ökonomie,"Pühringer, Stephan (+2 weitere)",2018,nicht begutachtet,Buch,,,,"Ötsch, W., Pühringer, S., & Hirte, K. (2018). Netzwerke des Marktes : Ordoliberalismus als Politische Ökonomie. Springer VS."
Right-wing populism and market-fundamentalism. Two mutually reinforcing threats to democracy in the 21st century,"Pühringer, Stephan (+1 weitere)",2017,begutachtet,Beitrag in Fachzeitschrift,,,,"Ötsch, W., & Pühringer, S. (2017). Right-wing populism and market-fundamentalism. Two mutually reinforcing threats to democracy in the 21st century. Journal of Language and Politics, 16(4), 497-509. https://doi.org/10.1075/jlp.17027.ots"
Formal Approaches to Socio-economic Analysis - Past and Perspectives,"Gräbner-Radkowitsch, Claudius",2018,begutachtet,Beitrag in Fachzeitschrift,,,,"Gräbner, C. (2018). Formal Approaches to Socio-economic Analysis - Past and Perspectives. Forum for Social Economics, 47(1), 32-63. https://doi.org/10.1080/07360932.2015.1042491"
Agent-based computational models - a formal heuristic for institutionalist pattern modelling?,"Gräbner-Radkowitsch, Claudius",2016,begutachtet,Beitrag in Fachzeitschrift,,,,"Gräbner, C. (2016). Agent-based computational models - a formal heuristic for institutionalist pattern modelling? Journal of Institutional Economics, 12(1), 241-261. https://doi.org/10.1017/S1744137415000193"
Getting the Best of Both Worlds? Developing Complementary Equation-Based and Agent-Based Models,"Gräbner-Radkowitsch, Claudius",2019,begutachtet,Beitrag in Fachzeitschrift,,,,"Gräbner, C., Bale, C. S. E., Furtado, B. A., & Alvarez-Pereira, B. et al. (2019). Getting the Best of Both Worlds? Developing Complementary Equation-Based and Agent-Based Models. Computational Economics, 53(2), 763-782. https://doi.org/10.1007/s10614-017-9763-8"
Dealing adequately with the political element in formal modelling,"Gräbner-Radkowitsch, Claudius",2017,begutachtet,Beitrag in Buch/Bericht/Konferenzband,,,,"Gräbner, C. (2017). Dealing adequately with the political element in formal modelling. In Katsikides, Savas and Hanappi, Hardy and Scholz-Wäckerle, Manuel (Hrsg.), Theory and Method of Evolutionary Political Economy (S. 236-254). Routledge. "
Dialog nicht erwünscht,"Ötsch, Walter",2016,Nicht festgelegt,Beitrag in Fachzeitschrift,,,,"Graupe, S., & Ötsch, W. (2016). Dialog nicht erwünscht. Forschung & Lehre, 23(11), 1000."
The performativity of potential output: Pro-cyclicality and path dependency in coordinating European fiscal policies,"Kapeller, Jakob (+1 weitere)",2017,begutachtet,Beitrag in Fachzeitschrift,,,,"Heimberger, P., & Kapeller, J. (2017). The performativity of potential output: Pro-cyclicality and path dependency in coordinating European fiscal policies. Review of International Political Economy, 24(5), 904-928. https://doi.org/10.1080/09692290.2017.1363797"
"Stability , fairness and random walks in the bargaining problem","Kapeller, Jakob (+1 weitere)",2017,begutachtet,Beitrag in Fachzeitschrift,,,,"Kapeller, J., & Steinerberger, S. (2017). Stability , fairness and random walks in the bargaining problem. Physica A: Statistical Mechanics and its Applications, 488, 60-71. https://doi.org/10.1016/j.physa.2017.07.008"
"Diskursverläufe in der universitären Agrarpolitik als neoliberales Hegemonialprojekt – Struktur, Ursache und Wirkungen","Hirte, Katrin",2009,nicht begutachtet,Beitrag in Buch/Bericht/Konferenzband,,,,"Hirte, K. (2009). Diskursverläufe in der universitären Agrarpolitik als neoliberales Hegemonialprojekt – Struktur, Ursache und Wirkungen. In Ötsch, Walter; Thomasberger, Claus (Hrsg.), Der neoliberale Marktdiskurs (S. 187-212). Metropolis. "
Did Fiscal Consolidation Cause the Double-Dip Recession in the Euro Area?,"Heimberger, Philipp",2017,begutachtet,Beitrag in Fachzeitschrift,,,,"Heimberger, P. (2017). Did Fiscal Consolidation Cause the Double-Dip Recession in the Euro Area? Review of Keynesian Economics, 5(3), 439-458. https://doi.org/10.4337/roke.2017.03.06"
"Das ""strukturelle Defizit"" in der österreichischen Budgetpolitik: Berechnungsprobleme, Revisionen und wirtschaftspolitische Relevanz","Heimberger, Philipp",2016,nicht begutachtet,Beitrag in Fachzeitschrift,,,,"Heimberger, P. (2016). Das ""strukturelle Defizit"" in der österreichischen Budgetpolitik: Berechnungsprobleme, Revisionen und wirtschaftspolitische Relevanz. Wirtschaft und Gesellschaft, 42(3), 451-464."
"Minsky, die globle Finanzkrise und der nächste Finanz-Crash","Heimberger, Philipp",2016,Nicht festgelegt,Beitrag in Fachzeitschrift,,,,"Heimberger, P. (2016). Minsky, die globle Finanzkrise und der nächste Finanz-Crash. Wirtschaft und Gesellschaft, 42(3), 515-520."
"Wirtschaftliche Stagnation als ""neue Normalsituation""?","Heimberger, Philipp",2016,Nicht festgelegt,Beitrag in Fachzeitschrift,,,,"Heimberger, P. (2016). Wirtschaftliche Stagnation als ""neue Normalsituation""? Wirtschaft und Gesellschaft, 42(2), 356-361."
Die aktuelle Krise im wirtschaftshistorischen Vergleich mit der Großen Depression der 1930er-Jahre,"Heimberger, Philipp",2016,Nicht festgelegt,Beitrag in Fachzeitschrift,,,,"Heimberger, P. (2016). Die aktuelle Krise im wirtschaftshistorischen Vergleich mit der Großen Depression der 1930er-Jahre. Wirtschaft und Gesellschaft, 42(1), 161-173."
"Verankerung wohlstandorientierter Politik. Working Paper der Kammer für Arbeiter und Angestellte für Wien, Reihe „Materialien zu Wirtschaft und Gesellschaft“, Nr. 165","Griesser, Markus",2016,nicht begutachtet,Andere Beiträge,,,,"Griesser, M., & Brand, U. (2016, Dez). Verankerung wohlstandorientierter Politik. Working Paper der Kammer für Arbeiter und Angestellte für Wien, Reihe „Materialien zu Wirtschaft und Gesellschaft“, Nr. 165."
Ein philosophischer Blick auf die Grundlagen internationaler Ökonomie.,"Kapeller, Jakob",2016,nicht begutachtet,Beitrag in Buch/Bericht/Konferenzband,,,,"Kapeller, J. (2016). Ein philosophischer Blick auf die Grundlagen internationaler Ökonomie. In Till van Treeck, Janina Urban (Hrsg.), Wirtschaft neu denken – blinde Flecken der Lehrbuchökonomie (S. 108-116)"
Internationaler Freihandel: Theoretische Ausgangspunkte und empirische Folgen,"Kapeller, Jakob",2016,nicht begutachtet,Beitrag in Fachzeitschrift,,,,"Kapeller, J. (2016). Internationaler Freihandel: Theoretische Ausgangspunkte und empirische Folgen. Wirtschafts- und Sozialwissenschaftliche Zeitschrift, 39(1), 99-122."
Still the queens of social sciences? Economists as “public intellectuals” in/after the crisis.,"Pühringer, Stephan",2016,begutachtet,Beitrag in Buch/Bericht/Konferenzband,,,,"Pühringer, S. (2016). Still the queens of social sciences? Economists as “public intellectuals” in/after the crisis. In International Conference in Contemporary Social Sciences (Conference Proceedings) (Hrsg.), Crisis and the social sciences: New challenges and perspectives (S. 507-528)"
Zum Profil der deutschsprachigen Volkwirtschaftslehre. Paradigmatische Ausrichtung und politische Orientierung deutschsprachiger Ökonom_innen,"Pühringer, Stephan (+2 weitere)",2017,Nicht festgelegt,"Preprints, Working Paper und Forschungsberichte",,,,"Kapeller, J., Pühringer, S., & Grimm, C. (2017). Zum Profil der deutschsprachigen Volkwirtschaftslehre. Paradigmatische Ausrichtung und politische Orientierung deutschsprachiger Ökonom_innen. FGW-Studien."
Emergent Phenomena in Scientific Publishing: A Simulation Exercise,"Kapeller, Jakob (+1 weitere)",2016,begutachtet,Beitrag in Fachzeitschrift,,,,"Kapeller, J., & Steinerberger, S. (2016). Emergent Phenomena in Scientific Publishing: A Simulation Exercise. Research Policy, 45(10), 1945–1952. https://doi.org/10.1016/j.respol.2016.08.004"
"Government policies and financial crises: mitigation, postponement or prevention?","Kapeller, Jakob (+2 weitere)",2018,begutachtet,Beitrag in Fachzeitschrift,,,,"Landesmann, M., Kapeller, J., Mohr, F. X., & Schütz, B. (2018). Government policies and financial crises: mitigation, postponement or prevention? Cambridge Journal of Economics, 42(2), 309-330. https://doi.org/10.1093/cje/bew073"
Wie krank ist unser Wirtschaftssystem? Krisen als Krankheiten im ökonomischen Diskurs,"Pühringer, Stephan",2016,begutachtet,Beitrag in Fachzeitschrift,,,,"Pühringer, S., & Egger, J. (2016). Wie krank ist unser Wirtschaftssystem? Krisen als Krankheiten im ökonomischen Diskurs. Kuckuck. Notizen zur Alltagskultur, 31(1), 32-37."
Zur Performativität ökonomischen Wissens und aktuellen ÖkonomInnen-Netzwerken in Deutschland,"Pühringer, Stephan (+1 weitere)",2017,begutachtet,Beitrag in Buch/Bericht/Konferenzband,,,,"Hirte, K., & Pühringer, S. (2017). Zur Performativität ökonomischen Wissens und aktuellen ÖkonomInnen-Netzwerken in Deutschland. In Maeße, Jens; Pahl, Hanno; Sparsam, Jan (Hrsg.), Die Innenwelt der Ökonomie. Wissen, Macht und Performativität in der Wirtschaftswissenschaft (S. 363-390). Springer VS Verlag. "
From free to civilized trade: a European perspective,"Kapeller, Jakob (+1 weitere)",2016,begutachtet,Beitrag in Fachzeitschrift,,,,"Kapeller, J., Schütz, B., & Tamesberger, D. (2016). From free to civilized trade: a European perspective. Review of Social Economy, 74(3), 320-328. https://doi.org/10.1080/00346764.2016.1168033"
Agrarpolitik und Agrarökonomie. Zur Ambivalenz zweier wissenschaftlicher Disziplinen,"Hirte, Katrin",2017,Nicht festgelegt,Abschlussarbeiten,,,,"Hirte, K. (2017). Agrarpolitik und Agrarökonomie. Zur Ambivalenz zweier wissenschaftlicher Disziplinen. Universität Jena."
Modell-Platonismus in der Ökonomie. Zur Aktualität einer klassisch-epistemologischen Kritik,"Kapeller, Jakob",2011,Nicht festgelegt,Abschlussarbeiten,,,,"Kapeller, J. (2011). Modell-Platonismus in der Ökonomie. Zur Aktualität einer klassisch-epistemologischen Kritik. Universität Linz."
"Fiscal multipliers, unemployment and debt","Heimberger, Philipp",2018,Nicht festgelegt,Abschlussarbeiten,,,,"Heimberger, P. (2018). Fiscal multipliers, unemployment and debt. Wirtschaftsuniversität Wien."
Economic Change and Change in Economics,"Kapeller, Jakob",2014,Nicht festgelegt,Abschlussarbeiten,,,,"Kapeller, J. (2014). Economic Change and Change in Economics. Universität Linz."
Netzwerke im Internet – eine neue kritische Öffentlichkeit? Das Beispiel Guttenberg,"Hirte, Katrin",2016,begutachtet,Beitrag in Buch/Bericht/Konferenzband,,,,"Hirte, K. (2016). Netzwerke im Internet – eine neue kritische Öffentlichkeit? Das Beispiel Guttenberg. In Imhof, Kurt; Welz, Frank; Fleck, Christian; Vobruba, Georg (Hrsg.), Neuer Strukturwandel der Öffentlichkeit. Verhandlungen des dritten gemeinsamen Kongresses der Deutschen, Österreichischen und Schweizerischen Gesellschaft für Soziologie (S. 1-16). Springer. "
Das europäische Schattenbankensystem – Typologisierung und die Bewertung regulatorischer Initiativen auf europäischer Ebene,"Bräutigam, Lars (+1 weitere)",2016,nicht begutachtet,Buch,,,Materialien zu Wirtschaft und Gesellschaft. Working Paper-Reihe der AK Wien,"Beyer, K., & Bräutigam, L. (2016). Das europäische Schattenbankensystem – Typologisierung und die Bewertung regulatorischer Initiativen auf europäischer Ebene. (Materialien zu Wirtschaft und Gesellschaft. Working Paper-Reihe der AK Wien). Arbeiterkammer Wien."
Politik und ihre Ad-hoc- Gremien in Krisenzeiten,"Hirte, Katrin",2015,begutachtet,Beitrag in Buch/Bericht/Konferenzband,,,,"Hirte, K. (2015). Politik und ihre Ad-hoc- Gremien in Krisenzeiten. In Momentum-Kongress (Hrsg.), Momentum Kongress Paper (S. 1-22)"
"Bezeichnende Konstellation. Zum Eröffnungstag „Agrarpolitik“ in Österreich auf dem Podium: REWE, RWA Raiffeisen und Landwirtschaftskammer","Hirte, Katrin",2015,nicht begutachtet,Beitrag in Fachzeitschrift,,,,"Hirte, K. (2015). Bezeichnende Konstellation. Zum Eröffnungstag „Agrarpolitik“ in Österreich auf dem Podium: REWE, RWA Raiffeisen und Landwirtschaftskammer. Wege für eine bäuerliche Zukunft – Zeitschrift der ÖBV/ Via Campesina Austria, 38(2 (337)), 15."
Agrarische Regelungspolitik und die drei agrarpolitischen „Syndrome“,"Hirte, Katrin",2016,nicht begutachtet,Beitrag in Fachzeitschrift,,,,"Hirte, K. (2016). Agrarische Regelungspolitik und die drei agrarpolitischen „Syndrome“. Wege für eine bäuerliche Zukunft – Zeitschrift der ÖBV/ Via Campesina Austria, 39(3 (343)), 10-11."
"Postdemokratie, Machtverhältnisse und Ökonomie","Grimm, Christian",2016,begutachtet,Beitrag in Buch/Bericht/Konferenzband,,,,"Grimm, C. (2016). Postdemokratie, Machtverhältnisse und Ökonomie. In Momentum Kongress Paper (S. 1-22)"
"Die Evolution des ökonomischen Wissens und des Wissens über den Kapitalismus. Performativity als Analyseinstrument: das Beispiel der Fabian Society, der Mont Pèlerin Society und der Chicagoer Schule","Nordmann, Jürgen (+2 weitere)",2010,nicht begutachtet,Andere Beiträge,,,,"Ötsch, W., Hirte, K., & Nordmann, J. (2010). Die Evolution des ökonomischen Wissens und des Wissens über den Kapitalismus. Performativity als Analyseinstrument: das Beispiel der Fabian Society, der Mont Pèlerin Society und der Chicagoer Schule."
Gleichheit und Vielfalt – normative Konzeptionen? Die philosophischen Implikationen zum Problem Anerkennung bei Simone de Beauvoir und Hannah Arendt,"Hirte, Katrin",2011,begutachtet,Beitrag in Buch/Bericht/Konferenzband,,,,"Hirte, K. (2011). Gleichheit und Vielfalt – normative Konzeptionen? Die philosophischen Implikationen zum Problem Anerkennung bei Simone de Beauvoir und Hannah Arendt. In Momentum Kongress Paper (S. 1-15)"
ÖkonomInnen und Politik – Analyse zur politischen Einflussnahme deutschsprachiger ÖkonomInnen,"Pühringer, Stephan (+2 weitere)",2015,Nicht festgelegt,"Preprints, Working Paper und Forschungsberichte",,,,"Griesser, M., Hirte, K., & Pühringer, S. (2015). ÖkonomInnen und Politik – Analyse zur politischen Einflussnahme deutschsprachiger ÖkonomInnen. Forschungsbericht: Förderer: Jubiläumsfonds."
ÖkonomInnen und Ökonomie. Eine wissenschaftssoziologische Entwicklungsanalyse zum Verhältnis von ÖkonomInnen und Ökonomie im deutschsprachigen Raum ab 1945,"Pühringer, Stephan (+2 weitere)",2015,Nicht festgelegt,"Preprints, Working Paper und Forschungsberichte",,,,"Heise, A., Hirte, K., Ötsch, W., & Pühringer, S. et al. (2015). ÖkonomInnen und Ökonomie. Eine wissenschaftssoziologische Entwicklungsanalyse zum Verhältnis von ÖkonomInnen und Ökonomie im deutschsprachigen Raum ab 1945. Hans Böckler Stiftung."
Agrarpolitik und Arbeit – der Einfluss europäischer Agrarpolitikmaßnahmen auf die Arbeit im Agrarsektor,"Hirte, Katrin",2016,nicht begutachtet,Beitrag in Buch/Bericht/Konferenzband,,,,"Hirte, K., & Kuschel, S. (2016). Agrarpolitik und Arbeit – der Einfluss europäischer Agrarpolitikmaßnahmen auf die Arbeit im Agrarsektor. In Ahlert, Maximilian; Fiederer, Franca; Varelmann, Katharina; Kuschel, Sarah; Ewers, Sylvia; Politor, Merlin; Stamp, Katharina (Hrsg.), Frohes Schaffen!? Arbeit in der Landwirtschaft (S. 9-15). Universtity Press. "
"Die „Landnahme“-These von Rosa Luxemburg – empirisch beobachtbar, aber theoretisch falsifiziert?","Hirte, Katrin",2016,nicht begutachtet,Beitrag in Buch/Bericht/Konferenzband,,,,"Hirte, K. (2016). Die „Landnahme“-These von Rosa Luxemburg – empirisch beobachtbar, aber theoretisch falsifiziert? In Kapeller, Jakob; Pühringer, Stephan; Hirte, Katrin; Ötsch, Walter (Hrsg.), Ökonomie! Welche Ökonomie? (S. 273-313). Metropolis Verlag. "
Vorwort im Tagungsband Ökonomie! Welche Ökonomie?,"Pühringer, Stephan (+3 weitere)",2016,nicht begutachtet,Beitrag in Buch/Bericht/Konferenzband,,,,"Hirte, K., Kapeller, J., Pühringer, S., & Ötsch, W. (Hrsg.) (2016). Vorwort im Tagungsband Ökonomie! Welche Ökonomie? In Ökonomie! Welche Ökonomie? (S. 2-10). Metropolis Verlag. "
Replik zur Replik: Von Vorwürfen der Unwissenschaftlichkeit,"Pühringer, Stephan (+1 weitere)",2016,nicht begutachtet,Beitrag in Fachzeitschrift,,,,"Pühringer, S., & Stelzer-Orthofer, C. (2016). Replik zur Replik: Von Vorwürfen der Unwissenschaftlichkeit. SWS-Rundschau - Sozialwissenschaftliche Studiengesellschaft Rundschau, 3, 447-449."
Ökonomie! Welche Ökonomie? Stand und Status der Wirtschaftswissenschaften,"Pühringer, Stephan (+3 weitere)",2016,nicht begutachtet,Buch,,,,"Kapeller, J., Pühringer, S., Hirte, K., & Ötsch, W. (Hrsg.) (2016). Ökonomie! Welche Ökonomie? Stand und Status der Wirtschaftswissenschaften. Metropolis."
Neoliberale Think Tanks als (neue) Akteure in österreichischen gesellschafts- und sozialpolitischen Diskursen.,"Pühringer, Stephan (+1 weitere)",2016,nicht begutachtet,Beitrag in Fachzeitschrift,,,,"Pühringer, S., & Stelzer-Orthofer, C. (2016). Neoliberale Think Tanks als (neue) Akteure in österreichischen gesellschafts- und sozialpolitischen Diskursen. Die Beispiele des Hayek-Instituts und der Agenda Austria. SWS-Rundschau, 56(1), 75-96."
Evolutionary Political Economy and the Complexity of Economic Policy,"Kapeller, Jakob",2016,begutachtet,Beitrag in Buch/Bericht/Konferenzband,,,,"Kapeller, J., & Scholz-Wäckerle, M. (2016). Evolutionary Political Economy and the Complexity of Economic Policy. In Gräbner,  Claudius / Heinrich, Torsten / Schwardt, Henning (Hrsg.), Policy Implications of Recent Advances in Evolutionary and Institutional Economics (S. 99-122). Routledge. "
Shadow Banking and the Offshore Nexus - Some Considerations on the Systemic Linkages of Two Important Economic Phenomena,"Bräutigam, Lars (+1 weitere)",2015,Nicht festgelegt,"Preprints, Working Paper und Forschungsberichte",,40,ICAE Working Paper Series,"Beyer, K., & Bräutigam, L. (2015). Shadow Banking and the Offshore Nexus - Some Considerations on the Systemic Linkages of Two Important Economic Phenomena. (ICAE Working Paper Series; Nr. 40)."
Eine fiskalpolitische Lösung für die Eurozone,"Heimberger, Philipp",2015,Nicht festgelegt,Beitrag in Fachzeitschrift,,,,"Heimberger, P. (2015). Eine fiskalpolitische Lösung für die Eurozone. Wirtschaft und Gesellschaft, 41(3), 449-458."
"Spezialisierung, Stratifikation und internationale Wirtschaft: Verteilung, Arbeitsteilung und Klassenlagen aus globaler Perspektive","Kapeller, Jakob (+1 weitere)",2016,begutachtet,Beitrag in Buch/Bericht/Konferenzband,,,,"Kapeller, J., & Heimberger, P. (2016). Spezialisierung, Stratifikation und internationale Wirtschaft: Verteilung, Arbeitsteilung und Klassenlagen aus globaler Perspektive. In Momentum Kongress Paper (S. 1-20)"
